Top 15 Free OSINT Tools To Collect Data From Open Sources - Recorded Future;Learn how to use OSINT tools to collect and analyze publicly available data from various sources for cybersecurity, market research, and more. Explore the features and benefits of 15 popular free OSINT tools, such as Google Dorks, theHarvester, SecurityTrails API, and Recorded Future's Vulnerability Database.;https://www.recordedfuture.com/threat-intelligence-101/tools-and-technologies/osint-tools
What is open-source intelligence (OSINT)? - IBM;Open-source intelligence (OSINT) is the process of gathering and analyzing publicly available information to assess threats, make decisions or answer specific questions. Many organizations use OSINT as a cybersecurity tool to help gauge security risks and identify vulnerabilities in their IT systems.;https://www.ibm.com/think/topics/osint
OSINT Basics: What is OSINT? - osint.industries;Learn what OSINT stands for, its history, types, and applications in various domains. OSINT is the process of collecting and analysing data from publicly accessible sources to generate actionable insights.;https://www.osint.industries/post/osint-basics-what-is-osint
What is the OSINT Framework? How can you use it? - Recorded Future;Open Source Intelligence (OSINT) is a critical tool used by cybersecurity professionals to identify compromised credentials, potential vulnerabilities within organizations, and overall cyber risks. It facilitates timely detection of sensitive data exposure , allowing cybersecurity teams to implement quick responses including security patches ...;https://www.recordedfuture.com/threat-intelligence-101/intelligence-sources-collection/osint-framework
What Is Open Source Intelligence (OSINT)? - Recorded Future;Open Source Intelligence (OSINT) is the practice of gathering, analyzing, and disseminating information from publicly available sources to address specific intelligence requirements. Of all the threat intelligence subtypes, open source intelligence (OSINT) is perhaps the most widely used, which makes sense.;https://www.recordedfuture.com/blog/open-source-intelligence-definition
What is Open-Source Intelligence (OSINT)? | CyberArrow;"Open-Source Intelligence (OSINT) refers to the process of gathering and analyzing publicly available information to gain insights. The ""open-source"" in OSINT doesn't mean open-source software, it refers to information that is freely accessible to the public. This can include:";https://www.cyberarrow.io/blog/what-is-open-source-intelligence-osint/
What's OSINT? Open-Source Intelligence Explained - Splunk;OSINT stands for open-source intelligence, the practice of collecting and analyzing publicly available data to generate actionable intelligence. Learn how OSINT can help security professionals detect threats, understand adversaries, and protect digital assets, and explore some key sources and tools for OSINT.;https://www.splunk.com/en_us/blog/learn/open-source-intelligence-osint.html
What Is Open Source Intelligence (OSINT)? - Built In;OSINT is the analysis of public information from various sources, such as social media, news, government websites and more. Learn how OSINT can help businesses, governments, journalists and others make informed decisions and address specific challenges.;https://builtin.com/articles/open-source-intelligence-osint
Open-source intelligence professionalism: Distinguishing 'OSINT' from ...;"There is a current chasm between multiple definitions of the term ""open-source intelligence"" (OSINT). For example, the U.S. Intelligence Community's narrow legal definition of OSINT is perhaps the most highly regulated and rigorously overseen government function in America's constitutional balance of powers, with potential impacts on individual civil liberties and privacy.";https://federalnewsnetwork.com/commentary/2024/10/open-source-intelligence-professionalism-distinguishing-osint-from-pro-sint/
Open Source Intelligence (OSINT): Top Tools and Techniques;Open source intelligence (OSINT) is the process of identifying, harvesting, processing, analyzing, and reporting data obtained from publicly available sources for intelligence purposes. Open source intelligence analysts use specialized methods to explore the diverse landscape of open source intelligence and pinpoint any data that meets their objectives.;https://www.upguard.com/blog/open-source-intelligence
